[
  {
    "customerID": "9867-JCZSP",
    "gender": "Female",
    "SeniorCitizen": 0,
    "Partner": "Yes",
    "Dependents": "Yes",
    "tenure": 17,
    "PhoneService": "Yes",
    "MultipleLines": "No",
    "InternetService": "No",
    "OnlineSecurity": "No internet service",
    "OnlineBackup": "No internet service",
    "DeviceProtection": "No internet service",
    "TechSupport": "No internet service",
    "StreamingTV": "No internet service",
    "StreamingMovies": "No internet service",
    "Contract": "One year",
    "PaperlessBilling": "No",
    "PaymentMethod": "Mailed check",
    "MonthlyCharges": 20.75,
    "TotalCharges": "418.25",
    "Churn": "No",
    "event_ts": "2025-10-10T16:57:25.154355Z"
  },
  {
    "customerID": "4671-VJLCL",
    "gender": "Female",
    "SeniorCitizen": 0,
    "Partner": "No",
    "Dependents": "No",
    "tenure": 63,
    "PhoneService": "Yes",
    "MultipleLines": "Yes",
    "InternetService": "DSL",
    "OnlineSecurity": "Yes",
    "OnlineBackup": "Yes",
    "DeviceProtection": "Yes",
    "TechSupport": "Yes",
    "StreamingTV": "Yes",
    "StreamingMovies": "No",
    "Contract": "Two year",
    "PaperlessBilling": "Yes",
    "PaymentMethod": "Credit card (automatic)",
    "MonthlyCharges": 79.85,
    "TotalCharges": "4861.45",
    "Churn": "No",
    "event_ts": "2025-10-10T19:43:01.169986Z"
  },
  {
    "customerID": "7760-OYPDY",
    "gender": "Female",
    "SeniorCitizen": 0,
    "Partner": "No",
    "Dependents": "No",
    "tenure": 2,
    "PhoneService": "Yes",
    "MultipleLines": "No",
    "InternetService": "Fiber optic",
    "OnlineSecurity": "No",
    "OnlineBackup": "No",
    "DeviceProtection": "No",
    "TechSupport": "No",
    "StreamingTV": "Yes",
    "StreamingMovies": "No",
    "Contract": "Month-to-month",
    "PaperlessBilling": "Yes",
    "PaymentMethod": "Electronic check",
    "MonthlyCharges": 80.65,
    "TotalCharges": "144.15",
    "Churn": "Yes",
    "event_ts": "2025-10-11T03:28:23.234190Z"
  },
  {
    "customerID": "4667-QONEA",
    "gender": "Female",
    "SeniorCitizen": 1,
    "Partner": "Yes",
    "Dependents": "Yes",
    "tenure": 60,
    "PhoneService": "Yes",
    "MultipleLines": "No",
    "InternetService": "DSL",
    "OnlineSecurity": "Yes",
    "OnlineBackup": "Yes",
    "DeviceProtection": "Yes",
    "TechSupport": "Yes",
    "StreamingTV": "No",
    "StreamingMovies": "Yes",
    "Contract": "One year",
    "PaperlessBilling": "Yes",
    "PaymentMethod": "Credit card (automatic)",
    "MonthlyCharges": 74.85,
    "TotalCharges": "4456.35",
    "Churn": "No",
    "event_ts": "2025-10-11T12:54:59.440925Z"
  },
  {
    "customerID": "8769-KKTPH",
    "gender": "Female",
    "SeniorCitizen": 0,
    "Partner": "Yes",
    "Dependents": "Yes",
    "tenure": 63,
    "PhoneService": "Yes",
    "MultipleLines": "Yes",
    "InternetService": "Fiber optic",
    "OnlineSecurity": "Yes",
    "OnlineBackup": "No",
    "DeviceProtection": "No",
    "TechSupport": "No",
    "StreamingTV": "Yes",
    "StreamingMovies": "Yes",
    "Contract": "One year",
    "PaperlessBilling": "Yes",
    "PaymentMethod": "Credit card (automatic)",
    "MonthlyCharges": 99.65,
    "TotalCharges": "6311.2",
    "Churn": "No",
    "event_ts": "2025-10-11T01:35:51.469193Z"
  },
  {
    "customerID": "3957-SQXML",
    "gender": "Female",
    "SeniorCitizen": 0,
    "Partner": "Yes",
    "Dependents": "Yes",
    "tenure": 34,
    "PhoneService": "Yes",
    "MultipleLines": "Yes",
    "InternetService": "No",
    "OnlineSecurity": "No internet service",
    "OnlineBackup": "No internet service",
    "DeviceProtection": "No internet service",
    "TechSupport": "No internet service",
    "StreamingTV": "No internet service",
    "StreamingMovies": "No internet service",
    "Contract": "Two year",
    "PaperlessBilling": "No",
    "PaymentMethod": "Credit card (automatic)",
    "MonthlyCharges": 24.95,
    "TotalCharges": "894.3",
    "Churn": "No",
    "event_ts": "2025-10-11T03:20:57.497336Z"
  },
  {
    "customerID": "0434-CSFON",
    "gender": "Female",
    "SeniorCitizen": 0,
    "Partner": "Yes",
    "Dependents": "No",
    "tenure": 47,
    "PhoneService": "Yes",
    "MultipleLines": "Yes",
    "InternetService": "Fiber optic",
    "OnlineSecurity": "No",
    "OnlineBackup": "No",
    "DeviceProtection": "Yes",
    "TechSupport": "No",
    "StreamingTV": "Yes",
    "StreamingMovies": "Yes",
    "Contract": "Month-to-month",
    "PaperlessBilling": "Yes",
    "PaymentMethod": "Electronic check",
    "MonthlyCharges": 100.5,
    "TotalCharges": "4707.1",
    "Churn": "No",
    "event_ts": "2025-10-11T12:50:47.633143Z"
  },
  {
    "customerID": "0526-SXDJP",
    "gender": "Male",
    "SeniorCitizen": 0,
    "Partner": "Yes",
    "Dependents": "No",
    "tenure": 72,
    "PhoneService": "No",
    "MultipleLines": "No phone service",
    "InternetService": "DSL",
    "OnlineSecurity": "Yes",
    "OnlineBackup": "Yes",
    "DeviceProtection": "Yes",
    "TechSupport": "No",
    "StreamingTV": "No",
    "StreamingMovies": "No",
    "Contract": "Two year",
    "PaperlessBilling": "No",
    "PaymentMethod": "Bank transfer (automatic)",
    "MonthlyCharges": 42.1,
    "TotalCharges": "2962",
    "Churn": "No",
    "event_ts": "2025-10-11T03:01:42.660256Z"
  },
  {
    "customerID": "5122-CYFXA",
    "gender": "Female",
    "SeniorCitizen": 0,
    "Partner": "No",
    "Dependents": "No",
    "tenure": 3,
    "PhoneService": "Yes",
    "MultipleLines": "No",
    "InternetService": "DSL",
    "OnlineSecurity": "No",
    "OnlineBackup": "Yes",
    "DeviceProtection": "No",
    "TechSupport": "Yes",
    "StreamingTV": "Yes",
    "StreamingMovies": "Yes",
    "Contract": "Month-to-month",
    "PaperlessBilling": "Yes",
    "PaymentMethod": "Electronic check",
    "MonthlyCharges": 75.3,
    "TotalCharges": "244.1",
    "Churn": "No",
    "event_ts": "2025-10-11T15:43:26.700552Z"
  },
  {
    "customerID": "8627-ZYGSZ",
    "gender": "Male",
    "SeniorCitizen": 0,
    "Partner": "Yes",
    "Dependents": "No",
    "tenure": 47,
    "PhoneService": "Yes",
    "MultipleLines": "Yes",
    "InternetService": "Fiber optic",
    "OnlineSecurity": "No",
    "OnlineBackup": "Yes",
    "DeviceProtection": "No",
    "TechSupport": "No",
    "StreamingTV": "No",
    "StreamingMovies": "No",
    "Contract": "One year",
    "PaperlessBilling": "Yes",
    "PaymentMethod": "Electronic check",
    "MonthlyCharges": 78.9,
    "TotalCharges": "3650.35",
    "Churn": "No",
    "event_ts": "2025-10-11T13:24:56.715473Z"
  }
]